{
  "version": "3.1.0",
  "personalInfo": {
    "name": "Rahul Yedida",
    "suffix": "",
    "contact": {
      "email": "hello@ryedida.me",
      "phone": "+1 (206) 660-7542"
    },
    "links": [
      {
        "display": "Website",
        "url": "https://ryedida.me"
      },
      {
        "display": "GitHub",
        "url": "https://github.com/yrahul3910"
      },
      {
        "display": "LinkedIn",
        "url": "https://www.linkedin.com/in/rahul-yedida/"
      },
      {
        "display": "Google Scholar",
        "url": "https://scholar.google.com/citations?user=0lP2AvkAAAAJ&hl=en"
      },
      {
        "display": "Google Developers",
        "url": "https://g.dev/ryedida"
      }
    ]
  },
  "education": [
    {
      "institution": "North Carolina State University",
      "location": "Raleigh, NC",
      "degree": "Ph.D. Computer Science",
      "details": [
        "Advisor: Dr. Tim Menzies",
        "Dissertation: \\href{https://repository.lib.ncsu.edu/items/671bafe0-ac75-40e6-a705-27a5ede3793f}{Guidelines for the Application of Neural Technologies in Software Analytics (or: How to Do More with Less in SE)}"
      ],
      "dates": ["2019-08-01", "2024-07-30"]
    },
    {
      "institution": "PES University",
      "location": "Bangalore, India",
      "degree": "B.E. Computer Science -- Advisor: Dr. Snehanshu Saha",
      "dates": ["2015-08-01", "2019-05-01"]
    }
  ],
  "employment": [
    {
      "organization": "LexisNexis Legal \\& Professional",
      "location": "Raleigh, NC",
      "positions": [
        {
          "position": "Senior Data Scientist II",
          "dates": ["2026-10-04", null],
          "details": [
            "Benchmarked 15 open-source structured decision models (System One) against four LLM baselines across six classification tasks; fine-tuned three Pareto-optimal models (best-model held-out macro-F1: 92.7\\%) to improve latency (M4 Pro, median: 177 ms, p95: 254 ms)."
          ],
          "tags": ["ml_emp"]
        },
        {
          "position": "Senior Data Scientist II",
          "dates": ["2026-10-04", null],
          "details": [
            "System One (Jev-like) models: 15 models, 4 LLM baselines, 6 tasks, 570 total samples. Running locally (M4 Pro), best model was GLiNER-2.5-Decide, latency median: 177 ms, p95: 254 ms. On held-out test set, macro-F1: 92.7\\%, accuracy: 97.3\\%"
          ],
          "tags": ["hidden"]
        },
        {
          "position": "Senior Data Scientist I",
          "dates": ["2024-05-24", "2026-10-04"],
          "details": [
            "Technical lead for an agentic legal drafting system; led its migration from RAG and continue to own development.",
            "Reduced customer-facing product runtime by 24.8\\% through LLM call profiling and parallelization.",
            "Profiled high pod memory usage and introduced lazy module loading, reducing time at peak memory from 86.4\\% to 68\\% of runtime.",
            "On a 3-person team, increased the share of drafts rated suitable for users by attorney reviewers from 40\\% to 86\\% for complaints and 59.2\\% to 76\\% for motions.",
            "Built a contrastive-learning filter to remove unrelated legal passages from search results; median filtering latency of 12ms across 40 queries.",
            "Mentored an intern on a large-scale, full factorial experiment investigating Pareto-optimal configurations for draft quality and latency.",
            "Built team developer tooling: a Rust MITM proxy with request replay, a web UI for visualizing intermediate agent steps, and custom Python lint rules beyond \\texttt{ruff}'s rule set.",
            "\\textbf{Technology:} Python, Litestar, Google ADK, React, Rust, TypeScript, Tailwind"
          ],
          "tags": ["ml_emp"]
        },
        {
          "position": "Senior Data Scientist I",
          "dates": ["2024-05-24", "2026-10-04"],
          "details": [
            "--- Performance improvements ---",
            "Profiled unexpectedly high pod memory usage, identified module allocations, and introduced lazy loading. Reduced the share of runtime spent at peak memory from 86.4\\% to 68\\%; this measures duration at peak, not a reduction in peak memory allocation.",
            "Profiled LLM calls and fixed inefficiencies, leading to a 10\\% reduction in runtime.",
            "Refactored and parallelized code for a 16.4\\% speedup.",
            "--- Drafting improvements ---",
            "Usefulness is the percentage of drafts rated suitable for users by attorney reviewers.",
            "Complaint improvements: 40\\% --> 70\\% --> 86\\% usefulness.",
            "Motion improvements: 59.2\\% --> 81.6\\% --> 76\\% usefulness.",
            "Proposed tabu search and Bayesian optimization methods for prompt tuning.",
            "--- Developer tooling ---",
            "MITM proxy in Rust with replay support and saving to HAR.",
            "Style checker scripts (Python): avoid future-annotations import, prefer PEP 695 generic syntax over TypeVar, etc.",
            "TSX-based UI to visualize agentic system runtime steps",
            "\\texttt{lnav} configuration for structured log viewing",
            "--- Innovation ---",
            "Passage filtering removes unrelated legal passages returned by retrieval. InfoNCE + alignment and uniformity losses, greedy search based on ultrafilters. Median filtering latency of 12ms across 40 search queries; 40 is the query count, not the number of passages.",
            "Agentic system: ADK; strong typing; led design and dev, acted as informed captain",
            "\\textbf{Technology:} Python, Litestar, Google ADK, React, TypeScript, Tailwind"
          ],
          "tags": ["hidden"]
        }
      ]
    },
    {
      "organization": "North Carolina State University",
      "location": "Raleigh, NC",
      "positions": [
        {
          "position": "PhD Student",
          "dates": ["2019-08-16", "2024-07-30"],
          "details": [
            "\\textbf{Hyper-parameter optimization:} Proposed an optimizer that outperformed prior methods and ran 36.4\\% faster than Hyperopt on datasets used in the NeurIPS 2020 BBO Challenge.",
            "\\textbf{Defect prediction:} Proposed GHOST, an adaptive oversampling and hyper-parameter tuning pipeline that outperformed prior deep-learning methods on 14 of 20 defect-prediction datasets.",
            "\\textbf{Semi-supervised learning:} Developed GHOST2 for identifying actionable static-analysis warnings; achieved median AUC of 0.92 across eight open-source Java projects using 10\\% of the training labels.",
            "\\textbf{Teaching:} TA for 830 students over 5 semesters across CSC 230 (C and Software Tools), CSC 510 (Software Engineering), and CSC 591/791 (Automated Software Engineering)"
          ],
          "tags": ["phd"]
        },
        {
          "position": "PhD Student",
          "dates": ["2019-08-16", "2024-07-30"],
          "details": [
            "HPO: 36.4\\% compared to Hyperopt, the fastest of the other SOTA optimizers. Compared on same datasets used in NeurIPS BBO Challenge 2020; p = 0.016.",
            "Improved defect prediction by up to 123\\% (F-1 score), code smell detection by up to 30\\% (AUC), issue lifetime prediction by up to 76\\% (accuracy), automated microservice partitioning by up to 285\\% (modularity) compared to prior SOTA.",
            "Achieved state-of-the-art results (up to 100\\% improvement in AUC) on static code warnings analysis using 10\\% of the labels."
          ],
          "tags": ["hidden"]
        },
        {
          "position": "Graduate Teaching Assistant",
          "dates": ["2023-08-16", "2024-05-12"],
          "details": [
            "TA (with 2 others) for 52 students for a graduate Automated Software Engineering course.",
            "TA (with 4 others) for 289 students for a graduate Software Engineering course."
          ],
          "tags": ["ml_emp", "ta"]
        },
        {
          "position": "Graduate Teaching Assistant",
          "dates": ["2022-08-16", "2023-05-15"],
          "details": [
            "TA (with 3 others) for 97 students for a graduate Automated Software Engineering course.",
            "TA (with 4 others) for 233 students for a graduate Software Engineering course."
          ],
          "tags": ["ml_emp", "ta"]
        },
        {
          "position": "Graduate Research Assistant",
          "dates": ["2020-01-01", "2022-05-15"],
          "details": [
            "\\textbf{Better, faster deep learning for SE:} Improved defect prediction by up to 123\\% (F-1 score), code smell detection by up to 30\\% (AUC)",
            "\\textbf{Semi-supervised learning:} Achieved state-of-the-art results on static code warnings analysis using 10\\% of the labels."
          ],
          "tags": ["ml_emp", "ta"]
        },
        {
          "position": "Graduate Teaching Assistant",
          "dates": ["2019-08-16", "2019-12-31"],
          "details": [
            "TA (with 1 other) for 159 students for an undergraduate C and Software Tools course."
          ],
          "tags": ["ml_emp", "ta"]
        }
      ]
    },
    {
      "organization": "Amazon",
      "location": "New York, NY / Bellevue, WA",
      "positions": [
        {
          "position": "Software Dev Engineer Intern",
          "dates": ["2023-05-15", "2023-08-04"],
          "details": [
            "Implemented and shipped profile locks for Prime Video on Echo Show devices.",
            "\\textbf{Technology:} React Native, TypeScript"
          ],
          "tags": ["sde_emp"]
        },
        {
          "position": "Software Dev Engineer Intern",
          "dates": ["2022-05-09", "2022-07-15"],
          "details": [
            "Developed a full-stack system to publish announcements in scorecards used by delivery service partners.",